{
  "id": "entity-facet-ledger",
  "version": "1.0.0",
  "updated": "2026-09-26",
  "purpose": "Retain names, aliases, titles, gifts, capabilities, scene-bound powers, recurring roles, story beats, conclusions and unresolved edges for Potatoverse/project entities without forcing every public page to repeat the full record.",
  "principles": [
    "A facet is attached to an entity, but it is also typed by provenance, scope and confidence.",
    "A one-scene power is not promoted to a species trait until it recurs or a source explicitly generalizes it.",
    "Titles and epithets may be literary, social, self-declared, bestowed, comic or documentary; the type must stay attached to the label.",
    "Real-person ordinary capabilities remain separate from creative/project enhancements.",
    "A conclusion records what the archive currently thinks the evidence supports; it may change without erasing the earlier story beat.",
    "Unresolved questions remain first-class facets instead of being silently answered."
  ],
  "facet_types": {
    "alias": "Alternate name, handle or spelling.",
    "title": "Title, epithet, rank or honorific.",
    "capability": "Ordinary or project-specific ability/capacity.",
    "signature_trait": "Distinctive recurring trait strongly associated with the entity.",
    "species_trait": "Trait generalized to a collective/species.",
    "scene_power": "Power or property established only in one story/scene unless later repeated.",
    "role": "Recurring project, literary or social function.",
    "relation": "Stable relation to another being, place, system or concept.",
    "motif": "Recurring symbolic object, number, phrase or pattern.",
    "story_beat": "Dated or period-specific event that changes what the entity means.",
    "conclusion": "Current archive synthesis derived from several facets.",
    "boundary": "What must not be inferred or merged.",
    "open_question": "Unresolved recovery or interpretation question."
  },
  "strength_levels": {
    "canonical": "Repeated or explicitly established project canon.",
    "repeated": "Recovered independently in multiple scenes/sources.",
    "established_scene": "Clearly present in one bounded scene.",
    "interpretive": "Archive synthesis that fits evidence but is not itself a quoted/source-native label.",
    "hypothesis": "Useful possibility awaiting stronger recovery.",
    "unresolved": "Known gap or ambiguity."
  },
  "entities": {
    "potatoes": {
      "label": "Potatoes",
      "kind": "collective / variable ontology",
      "aliases": [
        "Potato collective",
        "Potatoes"
      ],
      "titles": [],
      "facets": [
        {
          "type": "capability",
          "label": "growth",
          "strength": "canonical",
          "scope": "collective",
          "provenance": "conversation + literary"
        },
        {
          "type": "capability",
          "label": "rooting / anchoring",
          "strength": "repeated",
          "scope": "collective",
          "provenance": "conversation + literary"
        },
        {
          "type": "capability",
          "label": "multiplication",
          "strength": "repeated",
          "scope": "collective",
          "provenance": "conversation"
        },
        {
          "type": "signature_trait",
          "label": "stored potential",
          "strength": "interpretive",
          "scope": "collective",
          "provenance": "cross-scene synthesis"
        },
        {
          "type": "role",
          "label": "community identity",
          "strength": "canonical",
          "scope": "project",
          "provenance": "public + project"
        },
        {
          "type": "role",
          "label": "spiritual-growth metaphor",
          "strength": "canonical",
          "scope": "project",
          "provenance": "project"
        },
        {
          "type": "scene_power",
          "label": "angelic vessel",
          "strength": "established_scene",
          "scope": "some 2026 scenes",
          "provenance": "2026-03-03 conversation"
        },
        {
          "type": "motif",
          "label": "direction after nourishment / fullness",
          "strength": "established_scene",
          "scope": "2026-03-03 story",
          "provenance": "conversation"
        },
        {
          "type": "story_beat",
          "label": "One Potato becomes seed-language that multiplies Potato Angels",
          "strength": "established_scene",
          "scope": "2026-03-09",
          "provenance": "conversation"
        },
        {
          "type": "story_beat",
          "label": "Potato gains eyes, ears and a job in explicit network/vocation language",
          "strength": "established_scene",
          "scope": "2026-04-09",
          "provenance": "conversation"
        },
        {
          "type": "conclusion",
          "label": "Potato is a polysemous project object, not one species definition",
          "strength": "canonical",
          "scope": "archive",
          "provenance": "cross-source synthesis"
        },
        {
          "type": "boundary",
          "label": "Literal tuber, Tim identity, badge, character, metaphysical node and angelic vessel must be typed per scene",
          "strength": "canonical",
          "scope": "archive",
          "provenance": "editorial"
        }
      ],
      "story_beats": [
        {
          "date": "2026-03-03",
          "label": "World of potatoes / angelic-vessel story"
        },
        {
          "date": "2026-03-09",
          "label": "One Potato / seed multiplication"
        },
        {
          "date": "2026-04-09",
          "label": "Eyes, ears, job and multiplied-Potato language"
        }
      ],
      "conclusions": [
        "Potato is best retained as a variable ontology with scene-level typing.",
        "Angelic status belongs only to scenes that establish it; it is not the default meaning of Potato."
      ],
      "open_questions": [
        "Which named potatoes are documentary handles, literary characters or created beings?",
        "When does multiplication shift from metaphor into species/cast language?"
      ]
    },
    "potato-angels": {
      "label": "Potato Angels",
      "kind": "created-being collective",
      "aliases": [
        "Angels / Potato Angels",
        "Potato angels"
      ],
      "titles": [],
      "facets": [
        {
          "type": "species_trait",
          "label": "wings",
          "strength": "repeated",
          "scope": "collective",
          "provenance": "multiple 2026 scenes"
        },
        {
          "type": "species_trait",
          "label": "many-eyed perception",
          "strength": "repeated",
          "scope": "collective",
          "provenance": "multiple 2026 scenes"
        },
        {
          "type": "capability",
          "label": "light-work / carving light into darkness",
          "strength": "established_scene",
          "scope": "collective story language",
          "provenance": "2026-03-15 conversation"
        },
        {
          "type": "scene_power",
          "label": "timeline levitation",
          "strength": "established_scene",
          "scope": "2026-03-15",
          "provenance": "conversation"
        },
        {
          "type": "scene_power",
          "label": "dimensional / spiral movement",
          "strength": "established_scene",
          "scope": "2026-03-15",
          "provenance": "conversation"
        },
        {
          "type": "scene_power",
          "label": "flaming-sword imagery",
          "strength": "established_scene",
          "scope": "2026-03-15",
          "provenance": "conversation"
        },
        {
          "type": "role",
          "label": "guardian / army role",
          "strength": "repeated",
          "scope": "collective",
          "provenance": "2026 stories"
        },
        {
          "type": "signature_trait",
          "label": "rooted cultivation before conquest",
          "strength": "interpretive",
          "scope": "collective ethos",
          "provenance": "2026-07-26 story synthesis"
        },
        {
          "type": "story_beat",
          "label": "10,000 light-made Potato Angels appear, varied in size but described as fast, strong, rooted, honorable, gentle and majestic",
          "strength": "established_scene",
          "scope": "2026-07-26",
          "provenance": "conversation/story"
        },
        {
          "type": "boundary",
          "label": "Do not generalize Matthew's unique side-view of the Ladder to the whole species",
          "strength": "canonical",
          "scope": "archive",
          "provenance": "editorial"
        },
        {
          "type": "boundary",
          "label": "Do not treat every winged Turble as a Potato Angel",
          "strength": "canonical",
          "scope": "archive",
          "provenance": "editorial"
        }
      ],
      "story_beats": [
        {
          "date": "2026-03-03",
          "label": "Potatoes become angelic vessels"
        },
        {
          "date": "2026-03-15",
          "label": "Power-set expansion"
        },
        {
          "date": "2026-07-17",
          "label": "Humanized male/female angels with wings of light and armor"
        },
        {
          "date": "2026-07-26",
          "label": "10,000 light-angels / cultivation ethos"
        }
      ],
      "conclusions": [
        "Potato Angel is a distinct created-being collective with stronger recurring supernatural traits than generic Potato.",
        "Species canon should be promoted only from repeated traits; one-off poetic powers remain scene-bound."
      ],
      "open_questions": [
        "Which recovered powers recur enough to become species canon?",
        "Are generic angels, Potato Angels, messengers and guardians distinct classes or overlapping roles?"
      ]
    },
    "matthew-potato": {